<?xml version="1.0" encoding="UTF-8"?>
<tns:BusinessProcessCatalog xmlns:tns="http://www.sap.com/BusinessProcessCatalog"
	xmlns:xsi="http://www.w3.org/2001/XMLSchema-instance"
	xsi:schemaLocation="http://www.sap.com/BusinessProcessCatalog ../BusinessProcessCatalog.xsd ">
	<tns:BusinessArea ID="100">
		<tns:Title>Procurement</tns:Title>
		<tns:ProcessGroup ID="101">
			<tns:Title>Operational Procurement</tns:Title>
			<tns:BusinessProcess 
				ID="102">
				<tns:Title>Purchase Order Processing</tns:Title>
				<tns:RealizedBusinessProcess
					ID="103">
					<tns:Title>Purchase Order Processing in ERP</tns:Title>
					<tns:RealizedBusinessProcessVariant ID="104">
						<tns:Title>Purchase Order Processing of Direct Materials</tns:Title>
					</tns:RealizedBusinessProcessVariant>
				</tns:RealizedBusinessProcess>
			</tns:BusinessProcess>
		</tns:ProcessGroup>
	</tns:BusinessArea>
	<tns:BusinessArea ID="105">
		<tns:Title>BusinessArea</tns:Title>
		<tns:ProcessGroup ID="106">
			<tns:Title>ProcessGroup</tns:Title>
			<tns:BusinessProcess ID="107">
				<tns:Title>BusinessProcess</tns:Title>
				<tns:RealizedBusinessProcess ID="108">
					<tns:Title>RealizedBusinessProcess</tns:Title>
					<tns:RealizedBusinessProcessVariant
						ID="109">
						<tns:Title>RealizedBusinessProcessVariant</tns:Title>
					</tns:RealizedBusinessProcessVariant>
				</tns:RealizedBusinessProcess>
			</tns:BusinessProcess>
		</tns:ProcessGroup>
	</tns:BusinessArea>
</tns:BusinessProcessCatalog>